Species_Name,Scientific_Name,Class_Type,Group_Family,Ecosystem,Habitat_Details,Conservation_Status,IUCN_Status_Code,Dominant_Threat_Factor,Conservation_Suggestions_Detailed,N_Current_Pop_Size,r_Intrinsic_Growth_Rate,Es_Environmental_Stochasticity,Habitat_Quality_Index,Threat_Score_Pollution,Threat_Score_Overfishing,Threat_Score_ClimateChange,Overharvest_Rate,Conservation_Priority_Score
Starry Triggerfish,Abalistes stellatus,Marine Fish,Balistidae,Marine,Found over sandy and muddy bottoms in deep coastal waters and offshore.,Least Concern,LC,Often caught as bycatch in trawl fisheries,None specifically needed.,26978.71429,0.122977096,0.162500295,0.572750288,0.527205072,0.596389005,0.474083496,0.15861672,3.66
Indian Threadfin,Polydactylus indicus,Marine Fish,Polynemidae,Marine,"Found in coastal waters and estuaries, typically over muddy substrates. It is a large, highly valued food fish.",Vulnerable,VU,Severe overfishing and habitat loss in estuarine nursery areas,Implementing and strictly enforcing fishing quotas and minimum size limits.,26469.57143,0.160786937,0.205844117,0.647164722,0.654537488,0.348143784,0.392116561,0.126015253,5.32
Sixfinger Threadfin,Polydactylus sexfilis,Marine Fish,Polynemidae,Marine,"Found in coastal waters, surf zones, and sandy bottoms.",Least Concern,LC,Fishing pressure,Monitoring fishing efforts.,25144.57143,0.121264561,0.148493466,0.649637796,0.402098855,0.383354749,0.687607673,0.155679887,3.46
White,Siganus canaliculatus,Marine Fish,Siganidae,Marine,"Found in shallow, coastal waters, seagrass beds, and coral reefs. It is an herbivorous fish.",Least Concern,LC,Habitat destruction of seagrass beds and coral reefs,Protecting key feeding habitats.,23764,0.177946958,0.119492029,0.453315511,0.421158397,0.456689074,0.544208459,0.150666511,3.37
Indian Mackerel,Rastrelliger brachysoma,Short-bodied Mackerel,Scombridae,Marine,Found in large schools in coastal waters.,Least Concern,LC,High fishing pressure and habitat pollution in near,Sustainable fishery management.,19061,0.133482769,0.171069796,0.551494966,0.417841232,0.43911485,0.519813161,0.084478046,3.29
Mackerel,Rastrelliger faughni,Island Mackerel,Scombridae,Marine,Found in large schools in coastal and offshore waters.,Least Concern,LC,High fishing pressure,Monitoring fishing effort and stock health.,32234.28571,0.116763336,0.183668171,0.780639314,0.344036301,0.450270613,0.35992238,0.160670975,2.92
Horse Mackerel,Trachurus indicus,Indian Horse Mackerel,Carangidae,Marine,"A schooling, pelagic fish found in coastal and offshore waters.",Least Concern,LC,Heavy fishing pressure,Monitoring stock levels.,22460.42857,0.129511965,0.192075646,0.624522413,0.426898929,0.441394801,0.512157571,0.167419894,3.3
Giant Sea Catfish,Arius thalassinus,Marine Fish,Ariidae,Marine,"Found in coastal waters, estuaries, and offshore areas over mud bottoms.",Least Concern,LC,Overfishing and coastal habitat degradation,Sustainable fishing practices.,19247.14286,0.121161895,0.235835502,0.602069929,0.523039349,0.344600052,0.496247085,0.148739033,3.27
Black Bream,Acanthopagrus berda,Black Sea Bream,Sparidae,Brackish,"Brackish/Marine. Found in coastal waters, estuaries, and lower reaches of rivers.",Least Concern,LC,Habitat degradation in estuaries due to pollution and development,Protection of estuarine habitats.,30221.71429,0.122973107,0.212459948,0.628413638,0.374138595,0.330265225,0.487298004,0.138126934,2.99
Silver Sillago,Sillago sihama,Whiting,Sillaginidae,Marine,"Found in coastal waters, estuaries, and shallow sandy or muddy bottoms.",Least Concern,LC,Localized overfishing and habitat degradation of inshore waters and estuaries,Monitoring inshore fishing pressure.,20611.85714,0.076811621,0.221577437,0.597810473,0.421239526,0.380754773,0.562177994,0.151388589,3.27
Indian Threadfin,Polynemus paradiseus,Paradise Threadfin,Polynemidae,Marine,"Found in shallow, coastal waters and estuaries, especially over mud and sand bottoms.",Vulnerable,VU,Intense fishing pressure and habitat loss in its estuarine nursery areas,Protecting estuarine habitats and implementing fishing regulations.,31829.71429,0.102748148,0.213994449,0.613582559,0.461409407,0.498288219,0.498174855,0.15573281,5.43
Whipfin Mojarra,Gerres filamentosus,Marine Fish,Gerreidae,Marine,"Found in shallow, coastal waters, estuaries, and brackish lagoons.",Least Concern,LC,Habitat degradation of coastal nursery areas,Protecting estuarine habitats.,28565.85714,0.137971817,0.25454826,0.684500903,0.454503614,0.513917713,0.441575067,0.141491443,3.35
Green Chromide,Etroplus suratensis,Pearlspot,Cichlidae,Brackish,"Brackish/Freshwater. Found in estuaries, backwaters, and coastal freshwater lakes. It is the state fish of Kerala.",Least Concern,LC,Habitat loss in brackish water environments due to human development and pollution,Protecting backwater and estuarine ecosystems.,21499.14286,0.074227844,0.247120892,0.577885705,0.366148761,0.61213758,0.460901751,0.124821243,3.4
Indian Skittering Frog,Euphlyctis hexadactylus,Indian Pond Frog,Dicroglossidae,Freshwater,"This large frog is highly aquatic and lives in ponds, lakes, and other permanent water bodies.",Least Concern,LC,Habitat loss due to the draining of wetlands and pollution of water bodies,Protecting and restoring wetland habitats.,27912.85714,0.125693775,0.202796575,0.572939206,0.494955394,0.445951547,0.618189312,0.121663618,3.6
Laterite Chorus Frog,Microhyla laterite,Amphibian,Microhylidae,Freshwater (Endemic),Found exclusively in laterite rock formations and associated temporary pools and puddles in the coastal areas of Karnataka and Goa.,Data Deficient,DD,Habitat loss due to laterite quarrying and conversion of land for construction and agriculture,Urgent protection of laterite plateaus and associated seasonal habitats.,30018.57143,0.106962742,0.200965582,0.579528305,0.43975059,0.342648449,0.418161346,0.117376809,4.5
Bombay Caecilian,Ichthyophis bombayensis,Amphibian,Ichthyophiidae,Freshwater (Aquatic,Freshwater (Aquatic/Terrestrial). A burrowing species found in moist soil of moist evergreen forests and near streams.,Least Concern,LC,Habitat loss due to deforestation and human encroachment,Protecting its native forest habitats.,24804.28571,0.122840119,0.191765919,0.658702771,0.555219889,0.522524072,0.571497107,0.12270346,3.75
Scarlet,Puntius amphibius,Freshwater Fish,Cyprinidae,Freshwater,"Found in rivers, streams, ponds, and reservoirs throughout the low to mid-elevations of peninsular India. Highly adaptable.",Least Concern,LC,"Habitat degradation from pollution and siltation, and overfishing for local consumption and bait",Monitoring water quality and promoting sustainable local fishing practices.,24953.42857,0.172491853,0.190100271,0.621566031,0.400203298,0.521444701,0.408532766,0.131604101,3.22
Arulius Barb,Puntius arulius (Now Dawkinsia arulius),Now Dawkinsia arulius,Cyprinidae,Freshwater,"Endemic to the Cauvery River system in South India, preferring clear, running streams with rocky beds.",Vulnerable,VU,Habitat loss due to dams and agricultural encroachment,Strict regulation of collection for the aquarium trade. Protection and restoration of its endemic river habitats.,24021.14286,0.106962024,0.242836013,0.597113883,0.464936694,0.588552293,0.357970679,0.130721458,5.35
Bowany Barb,Puntius bovanicus (Now Dawkinsia bovanica),Now Dawkinsia bovanica,Cyprinidae,Freshwater,Found in rivers and streams in the Bhavani River system (a Cauvery tributary) and surrounding areas of the Western Ghats.,Vulnerable,VU,Habitat degradation caused by dams and weirs which alter natural water flow and block migration,Ensuring environmental flow requirements in regulated rivers and monitoring fishing pressure.,25555.71429,0.124657212,0.182546282,0.457132162,0.609587369,0.320810118,0.340768769,0.161826491,5.12
Long,Puntius dorsalis (Now Dawkinsia dorsalis),Now Dawkinsia dorsalis,Cyprinidae,Freshwater,"Found in streams, rivers, and ponds throughout peninsular India and Sri Lanka.",Least Concern,LC,Pollution and habitat loss due to human activity,Maintaining water quality in its varied habitats.,22790.14286,0.131205598,0.202018863,0.498863233,0.466021403,0.439145987,0.380412269,0.087860884,3.14
Mahecola Barb,Puntius mahecola (Now Dawkinsia mahecola),Now Dawkinsia mahecola,Cyprinidae,Freshwater,Found in streams and rivers of the southern Western Ghats.,Vulnerable,VU,Habitat degradation and fragmentation due to deforestation and agriculture,Protecting the forest streams in its endemic range.,25487.71429,0.118596151,0.16621559,0.617693858,0.538336579,0.362620067,0.453856962,0.070063509,5.26
Narayan's Barb,Puntius narayani (Now Puntius narayani),Now Puntius narayani,Cyprinidae,Freshwater,Endemic to the Cauvery River system in Karnataka. Found in clear streams.,Vulnerable,VU,"Habitat loss from deforestation, leading to siltation, and fragmentation from dams",Protecting river connectivity and controlling siltation.,23717.57143,0.088526834,0.155682041,0.58792484,0.545101412,0.492579295,0.521513075,0.177136702,5.6
Rohan's Barb,Puntius rohani (Now Puntius rohani),Now Puntius rohani,Cyprinidae,Freshwater,Endemic to the southern Western Ghats in Kerala. Found in hill streams.,Vulnerable,VU,Habitat loss and localized over,Monitoring collection and habitat protection.,30156.57143,0.141358474,0.194927716,0.716704149,0.690769709,0.426319454,0.559148387,0.135090606,5.79
Wynaad Barb,Puntius wynaadensis,Freshwater Fish,Cyprinidae,Freshwater,"Endemic to the Wayanad region (Western Ghats), found in clear, upland streams and rivers.",Vulnerable,VU,"Habitat loss and fragmentation due to deforestation, micro",Protecting the hill stream habitats and maintaining riparian health.,34181.14286,0.129986623,0.197281593,0.521803412,0.444621709,0.465982885,0.378741059,0.097316591,5.15
Assamese Garra,Garra gotyla,Freshwater Fish,Cyprinidae,Freshwater,"Found in rocky streams and rivers with fast current, mainly across northern, central, and parts of peninsular India.",Least Concern,LC,Habitat degradation from sand and gravel mining and river pollution,Protecting river substrates and controlling pollution.,29716.14286,0.11903048,0.216587918,0.583459584,0.426205158,0.459152431,0.490009552,0.130335144,3.29
Hugh's Garra,Garra hughi,Freshwater Fish,Cyprinidae,Freshwater,"Endemic to the upper reaches of rivers in the southern Western Ghats (Kerala and Tamil Nadu). Prefers clear, running water.",Vulnerable,VU,Habitat loss due to hydroelectric projects and water abstraction for irrigation,Protecting the water flow and quality of its endemic habitats.,27649.57143,0.138317201,0.186598898,0.58659452,0.437046624,0.529053129,0.586930663,0.14407127,5.59
Surendranath's Garra,Garra surendranathanii,Freshwater Fish,Cyprinidae,Freshwater,Endemic to the Periyar River system in the southern Western Ghats. Found in swift-flowing streams.,Vulnerable,VU,Habitat degradation and fragmentation from dams and human activities along the river,Protecting the critical river stretches and regulating sand mining.,23950.57143,0.125634475,0.205665207,0.570714309,0.368328152,0.508364573,0.471769611,0.13747172,5.25
Nilgiri Loach,Schistura nilgiriensis,Freshwater Fish,Nemacheilidae,Freshwater,"Endemic to the Nilgiri Hills in the Western Ghats. Found in clear, fast-flowing hill streams.",Endangered,EN,"Habitat loss due to the conversion of shola forests to tea and coffee plantations, leading to water abstraction and habitat degradation",Protection of headwater streams and shola forest patches.,26909.14286,0.124609153,0.222498699,0.647134704,0.464135816,0.315701303,0.684694614,0.147615673,6.44
Semiarmatus Loach,Schistura semiarmatus,Freshwater Fish,Nemacheilidae,Freshwater,"Found in hill streams and rivers in the Western Ghats region, preferring clear, cool, and fast-flowing water.",Least Concern,LC,Habitat degradation from siltation and pollution,Maintaining the ecological health of its stream habitats.,21773,0.146945754,0.207657801,0.491608276,0.556966582,0.519742878,0.518450848,0.100815078,3.66
Semiarmatus Loach,Nemacheilus semiarmatus,Freshwater Fish,Nemacheilidae,Freshwater,This name is an older synonym for Schistura semiarmatus (see No. 213). Habitat is hill streams and rivers in the Western Ghats.,Least Concern,LC,Habitat degradation,Stream habitat protection.,24442.28571,0.159326302,0.166934754,0.667125377,0.602527672,0.269187658,0.542751448,0.106602715,3.36
Mola Carplet,Amblypharyngodon mola,Freshwater Fish,Cyprinidae,Freshwater,"A small, schooling fish found in ponds, canals, ditches, and slow-moving water bodies across India.",Least Concern,LC,Habitat loss due to the draining of small wetlands and pollution,Protection of small freshwater bodies.,27393.28571,0.118695667,0.210738349,0.61986845,0.423728694,0.513605725,0.637297762,0.106514691,3.62
Attentive Carplet,Amblypharyngodon melettinus,Freshwater Fish,Cyprinidae,Freshwater,"Found in ponds, tanks, and streams primarily in peninsular India.",Least Concern,LC,Habitat loss and competition from introduced fish species,None specifically required.,32545.57143,0.133531378,0.19232021,0.629579767,0.533563675,0.397890326,0.337661555,0.164988168,3.12
Reba Carp,Cirrhinus reba,Freshwater Fish,Cyprinidae,Freshwater,"Found in rivers, canals, and tanks, often associated with the three major Indian carps (Catla, Rohu, Mrigal).",Least Concern,LC,Overfishing and habitat degradation in river systems,Sustainable management of river fisheries.,28708.57143,0.125522841,0.245238511,0.468126832,0.440049281,0.45346033,0.544357555,0.163866737,3.4
Vigors' Carp,Osteobrama vigorsii,Freshwater Fish,Cyprinidae,Freshwater,Endemic to the Krishna and Godavari River systems. Found in reservoirs and deeper pools of rivers.,Least Concern,LC,Habitat fragmentation from dams and introduction of non,Managing dam operations to allow for fish migration.,20512.14286,0.098508082,0.23356184,0.467258475,0.507297459,0.457683829,0.424798685,0.146804839,3.32
Neill's Carp,Osteobrama neilli,Freshwater Fish,Cyprinidae,Freshwater,"Endemic to the Krishna, Godavari, and Cauvery River systems in peninsular India.",Least Concern,LC,Habitat loss due to river regulation,Protecting its riverine habitats.,31977.42857,0.154698439,0.179076845,0.619786953,0.44402697,0.486807784,0.623344483,0.158944602,3.59
Golden Barb,Systomus chryseus (Previously Puntius chryseus),Previously Puntius chryseus,Cyprinidae,Freshwater,Found in streams and rivers of the southern Western Ghats.,Vulnerable,VU,Habitat loss and over,Monitoring the ornamental fish trade and protecting its stream habitats.,30658,0.187095978,0.185357222,0.609761913,0.414151733,0.473051224,0.503818707,0.131794057,5.32
Canara Baril,Barilius canarensis,Freshwater Fish,Cyprinidae,Freshwater (Endemic),"Found in hill streams and rivers of the Western Ghats (Karnataka). Prefers clear, rocky-bottomed, fast-flowing water.",Vulnerable,VU,Habitat degradation due to siltation and alteration of stream flow from water abstraction or small dams,Protecting the stream quality and maintaining natural flow.,26052.71429,0.141246528,0.164209197,0.542264138,0.332398848,0.346349736,0.439337734,0.122081398,4.86
Cauvery Rasbora,Rasbora caverii,Freshwater Fish,Cyprinidae,Freshwater,"Endemic to the Cauvery River drainage system. Found in clear, moderately flowing streams and rivers.",Vulnerable,VU,"Habitat degradation due to pollution, siltation, and fragmentation caused by damming projects",Protecting key stretches of the Cauvery tributaries and controlling pollution.,19649.28571,0.109363762,0.224338809,0.550448873,0.598124041,0.428115117,0.426414015,0.140115614,5.42
Ghats Baril,Barilius gatensis,Freshwater Fish,Cyprinidae,Freshwater,"Endemic to the Western Ghats, inhabiting clear, torrential hill streams and upper reaches of rivers.",Least Concern,LC,Localized threats from habitat loss due to small check dams and water diversion,Maintaining the natural flow and quality of its endemic hill streams.,31125,0.122213751,0.219634361,0.473629694,0.431950348,0.441845485,0.393185302,0.172864058,3.11
Vagra Baril,Barilius vagra,Freshwater Fish,Cyprinidae,Freshwater,"Found in clear, fast-flowing rivers and streams throughout the northern Indian subcontinent and parts of peninsular India.",Least Concern,LC,No major threats,None specifically needed.,18414.71429,0.116930758,0.10957354,0.523422709,0.4459907,0.447310553,0.290761289,0.10037271,2.97
Day's Baril,Barilius evezardi,Freshwater Fish,Cyprinidae,Freshwater,"Found in hill streams and rivers in the Satpura, Vindhya, and Western Ghats ranges, typically favoring clear, fast-flowing water.",Least Concern,LC,Habitat degradation from sand and gravel mining and river pollution,Protecting the water quality of its stream habitats.,26445.71429,0.151163461,0.195891988,0.644277356,0.57286877,0.39306697,0.581781025,0.159858659,3.58
Wynaad Mahseer,Neolissochilus wynaadensis,Freshwater Fish,Cyprinidae,Freshwater (Endemic),"Found exclusively in clear, fast-flowing hill streams and rivers of the Wayanad region (Western Ghats).",Endangered,EN,"Habitat loss and fragmentation due to river damming, siltation from deforestation, and pollution from agricultural runoff",Urgent protection of its endemic river stretches. Regulating land use in the catchment areas to prevent siltation and pollution.,31037.71429,0.107963098,0.205063796,0.468166372,0.58567264,0.529923019,0.44968114,0.124579783,6.61
Pabo Catfish,Ompok pabo,Freshwater Fish,Siluridae,Freshwater,"Found in rivers and lakes, preferring deep pools with muddy bottoms. It is a highly valued food fish.",Vulnerable,VU,Overfishing due to high market price,Implementing fishing regulations and protecting its deep-water river and wetland habitats.,24242.42857,0.187026529,0.252229845,0.51260187,0.458073836,0.507101233,0.488735379,0.089202383,5.42
Red,Aorichthys aor,Freshwater Fish,Bagridae,Freshwater,"A large catfish found in main river channels and large reservoirs, preferring deep, clear water.",Near Threatened,NT,"Overfishing for its meat and habitat degradation in major river systems, including pollution and flow regulation from dams",Regulating fishing size limits and protecting the health of large rivers.,22887.28571,0.12978772,0.188936173,0.55796658,0.526459486,0.489934052,0.42268088,0.096975571,4.4
Children's Silond,Silonia childreni,Freshwater Fish,Schilbeidae,Freshwater,Found in large rivers and reservoirs in peninsular India. It is a schooling fish.,Least Concern,LC,Overfishing and habitat fragmentation due to river damming,Sustainable management of fishing and maintaining river connectivity.,24110.42857,0.131009464,0.158528774,0.768411695,0.395313527,0.420261267,0.734925929,0.145217641,3.58
Pangasius Catfish,Pangasius pangasius,Freshwater Fish,Pangasiidae,Freshwater,Found in large rivers and estuaries. It is a migratory species.,Vulnerable,VU,Habitat fragmentation from dams blocking migratory routes,Protecting migratory routes and controlling the illegal stocking of non-native Pangasianodon species.,35090.71429,0.088186148,0.154315217,0.481160739,0.493508229,0.558346742,0.465048323,0.111411712,5.53
Gogra Rita,Rita gogra,Freshwater Fish,Bagridae,Freshwater,Found in large rivers and deep pools.,Least Concern,LC,Overfishing and habitat degradation in major river systems,Promoting sustainable fishing practices.,17763.14286,0.141545691,0.169271019,0.582169603,0.335618299,0.583542062,0.588913826,0.117400622,3.51
Golden Rita,Rita chrysea,Freshwater Fish,Bagridae,Freshwater,Found in rivers in the Mahanadi River basin and surrounding areas.,Least Concern,LC,Habitat degradation and localized overfishing,None specifically required; monitoring local water quality.,27496.71429,0.130656085,0.207762656,0.724326884,0.544119274,0.397968572,0.490994973,0.147656675,3.39
Dussumier's Catfish,Clarias dussumieri,Freshwater Fish,Clariidae,Freshwater,Found in slow-moving or stagnant water bodies in the southern Western Ghats (Kerala). It is an air-breathing fish.,Vulnerable,VU,Habitat loss due to the draining of wetlands and competition,Protecting wetland habitats and controlling invasive catfish species.,25088.14286,0.155032892,0.124268187,0.528383537,0.593782163,0.501625042,0.49498475,0.163492486,5.65
Goonch Catfish,Bagarius yarrelli,Freshwater Fish,Sisoridae,Freshwater (Large Rivers),"A very large, predatory catfish found in the main channels of large, fast-flowing rivers.",Near Threatened,NT,Overfishing,Regulating fishing and protecting the health and flow of large river ecosystems.,25291.42857,0.127607661,0.189371199,0.724142906,0.599519406,0.505364364,0.591020343,0.126741495,4.83
Poona Sisorid,Glyptothorax poonaensis,Freshwater Fish,Sisoridae,Freshwater,Found in hill streams and rivers in the northern Western Ghats. It has a specialized adhesive structure on its chest to cling to rocks.,Least Concern,LC,Habitat degradation,"Protecting the fast-flowing, clear stream habitats.",21023.57143,0.139328662,0.187541748,0.681160981,0.60361198,0.317617094,0.474231385,0.101963725,3.33
Tank Goby,Glossogobius giuris,Freshwater Fish,Gobiidae,Freshwater,"Highly adaptable, found in rivers, lakes, reservoirs, and estuaries.",Least Concern,LC,None major,None specifically needed.,29836.14286,0.117854269,0.162809607,0.471308335,0.592164559,0.295808456,0.466564461,0.110231786,3.26
Asian Sea Bass,Lates calcarifer,Bhekti,Latidae,Brackish,"Brackish/Marine. Found in estuaries, coastal waters, rivers, and lagoons. Juveniles utilize mangrove areas.",Least Concern,LC,Overfishing and habitat loss in critical mangrove and estuarine nursery areas,Protecting estuarine and mangrove habitats.,23165.14286,0.136013324,0.187757584,0.752870807,0.504560807,0.494191884,0.420717337,0.149431445,3.37
Spotted Snapper,Lutjanus johnii,Marine Fish,Lutjanidae,Marine,"Found over rocky bottoms, coral reefs, and in estuaries.",Least Concern,LC,Overfishing and habitat degradation of coastal areas and estuaries,Monitoring fishing pressure and protecting key nursery habitats.,19918.57143,0.138087519,0.222647965,0.637676819,0.525995559,0.575186136,0.49415445,0.145795562,3.66
Areolate Grouper,Epinephelus areolatus,Marine Fish,Serranidae,Marine,Found over sandy and muddy bottoms near reefs and rocky areas in coastal waters.,Least Concern,LC,Fishing pressure from trawling and hook,Monitoring and regulating fishing pressure.,25293.14286,0.159789746,0.206731773,0.58276206,0.495538333,0.346708616,0.518318047,0.104446462,3.27
Orange,Epinephelus coioides,Marine Fish,Serranidae,Marine,"Found in coastal and offshore reefs, rocky areas, and estuaries.",Near Threatened,NT,Heavy fishing pressure and destruction of coral reef and mangrove habitats,Establishing Marine Protected Areas (MPAs) and implementing size limits.,27622.28571,0.069948335,0.200212652,0.549927226,0.49892783,0.35208449,0.409649864,0.118058437,4.1
King Mackerel,Scomberomorus commerson,Narrow-barred Spanish Mackerel,Scombridae,Marine,"A large, highly migratory, pelagic fish found in coastal and offshore waters.",Least Concern,LC,High commercial fishing pressure across its range,Regional cooperation on implementing fishing quotas and size limits.,26803.28571,0.141485712,0.226176763,0.521135408,0.283759653,0.45001432,0.726350919,0.127489258,3.43
Indo,Scomberomorus guttatus,Marine Fish,Scombridae,Marine,Found in coastal waters over the continental shelf.,Least Concern,LC,Heavy fishing pressure,Implementing size limits and managing fishing quotas.,26670.85714,0.146846145,0.202797418,0.560960644,0.415502449,0.405115014,0.491042605,0.181183188,3.19
Frigate Tuna,Auxis thazard,Marine Fish,Scombridae,Marine,"A small, schooling, pelagic fish found in coastal and offshore waters.",Least Concern,LC,High fishing pressure,Monitoring fishing effort.,29745.57143,0.129296695,0.20724955,0.545234234,0.564059417,0.557243156,0.434619956,0.148298606,3.59
Kawakawa,Euthynnus affinis,Little Tuna,Scombridae,Marine,"A fast-swimming, pelagic fish found in coastal and offshore waters, often in large schools.",Least Concern,LC,High fishing pressure,Monitoring stock levels to ensure sustainable harvest.,22706.42857,0.082494582,0.214303553,0.594603223,0.399999696,0.449349272,0.400323775,0.111950173,3.08
Giant Trevally,Caranx ignobilis,Marine Fish,Carangidae,Marine,"Found in reefs, open coastal waters, and estuaries. A large, predatory fish.",Least Concern,LC,Overfishing,Regulating fishing size and catch limits.,19795.28571,0.138859312,0.227358895,0.583670825,0.536913523,0.446522262,0.44899715,0.077191377,3.39
Yellowtail Scad,Atule mate,Marine Fish,Carangidae,Marine,"A schooling, pelagic fish found in coastal waters and around islands.",Least Concern,LC,Heavy fishing pressure,Monitoring catch levels to prevent overexploitation.,20676.57143,0.137631321,0.193768579,0.542909479,0.451479493,0.22349087,0.528816256,0.151108648,3.01
Splendid Ponyfish,Leiognathus splendens,Marine Fish,Leiognathidae,Marine,"Found in coastal waters, estuaries, and mudflats. It's a small, schooling fish commonly caught by trawlers.",Least Concern,LC,Heavy fishing pressure and coastal habitat degradation,Monitoring stock levels.,21996.14286,0.135395644,0.182237524,0.586421182,0.480332176,0.307737752,0.559471775,0.12302922,3.25
Bindus Ponyfish,Leiognathus bindus,Marine Fish,Leiognathidae,Marine,"Inhabits coastal and brackish waters, often found over muddy bottoms.",Least Concern,LC,Heavy fishing pressure and coastal pollution,Sustainable fishing practices in coastal areas.,31002,0.144019878,0.19112366,0.462972905,0.503893474,0.495231525,0.481066884,0.112454643,3.47
Indian White Prawn,Penaeus indicus,Crustacean,Penaeidae,Marine,Juveniles are found in estuaries and backwaters (nursery grounds); adults live in coastal marine waters.,Not Evaluated,N/A,Intensive fishing pressure and habitat loss in estuarine nursery areas due to pollution and coastal development,Sustainable fishery management and protecting estuarine ecosystems.,29031.42857,0.143017233,0.153194723,0.654752173,0.515813256,0.302649942,0.494440273,0.171619432,4.69
