Species_Name,Scientific_Name,Class_Type,Group_Family,Ecosystem,Habitat_Details,Conservation_Status,IUCN_Status_Code,Dominant_Threat_Factor,Conservation_Suggestions_Detailed,N_Current_Pop_Size,r_Intrinsic_Growth_Rate,Es_Environmental_Stochasticity,Habitat_Quality_Index,Threat_Score_Pollution,Threat_Score_Overfishing,Threat_Score_ClimateChange,Overharvest_Rate,Conservation_Priority_Score
Red,Aorichthys aor,Freshwater Fish,Bagridae,Freshwater,"A large catfish found in main river channels and large reservoirs, preferring deep, clear water.",Near Threatened,NT,"Overfishing for its meat and habitat degradation in major river systems, including pollution and flow regulation from dams",Regulating fishing size limits and protecting the health of large rivers.,21280,0.126838218,0.223270209,0.587157128,0.501475267,0.501386331,0.545533095,0.154959703,4.58
Children's Silond,Silonia childreni,Freshwater Fish,Schilbeidae,Freshwater,Found in large rivers and reservoirs in peninsular India. It is a schooling fish.,Least Concern,LC,Overfishing and habitat fragmentation due to river damming,Sustainable management of fishing and maintaining river connectivity.,25323.42857,0.150706766,0.159663298,0.612661314,0.520085796,0.300103455,0.584968769,0.099005091,3.34
Pangasius Catfish,Pangasius pangasius,Freshwater Fish,Pangasiidae,Freshwater,Found in large rivers and estuaries. It is a migratory species. Note: this native species should not be confused with the imported Vietnamese 'Basa' (Pangasianodon hypophthalmus).,Vulnerable,VU,Habitat fragmentation from dams blocking migratory routes,Protecting migratory routes and controlling the illegal stocking of non-native Pangasianodon species.,27125.57143,0.12594384,0.280392983,0.662019961,0.52279123,0.386913069,0.634793146,0.16193845,5.57
Hamilton's Barila,Barilius bendelisis,Freshwater Fish,Cyprinidae,Freshwater,"Found in hill streams and rivers, usually preferring clear, cool, and fast-flowing water.",Least Concern,LC,Habitat degradation,Protecting the water quality of upland streams.,24878.42857,0.126259873,0.161458483,0.563438403,0.64440685,0.42371982,0.445956101,0.183095539,3.52
Common Loach,Lepidocephalus thermalis,Freshwater Fish,Cobitidae,Freshwater,"Found in stagnant or slow-moving water bodies with muddy substrates, such as ponds, rice paddies, and streams.",Least Concern,LC,Habitat loss due to the draining of small water bodies and pollution,None specifically needed; highly resilient.,28678,0.100946139,0.217309533,0.778608158,0.522998581,0.559226644,0.542350857,0.117438023,3.71
Semiarmatus Loach,Schistura semiarmatus,Freshwater Fish,Nemacheilidae,Freshwater,"Found in hill streams and rivers in the Western Ghats region, specifically favoring fast-flowing, clear water.",Least Concern,LC,Habitat degradation from siltation and pollution,Maintaining the ecological integrity of its stream habitats.,20537.85714,0.17366642,0.142451187,0.548744415,0.436459306,0.487144144,0.407719055,0.116075166,3.22
Mysore Stone Loach,Balitora mysorensis,Freshwater Fish,Balitoridae,Freshwater (Endemic),"Found in clear, fast-flowing, well-oxygenated hill streams in the Western Ghats. It adheres to rocks in strong currents.",Vulnerable,VU,Habitat degradation,Protecting the quality and natural flow regimes of its endemic hill streams.,25323.71429,0.11205814,0.159232181,0.598305093,0.394167294,0.497809069,0.580993461,0.09945541,5.45
Tentacled Loach,Parapsilorhynchus tentaculatus,Freshwater Fish,Cyprinidae,Freshwater,Found in streams and rivers in the Western Ghats.,Least Concern,LC,Habitat loss and siltation of stream habitats,Protecting its stream environment.,28164.14286,0.156796208,0.235240254,0.57184537,0.490662022,0.456840871,0.483511242,0.114687136,3.39
Hilsa Shad,Tenualosa ilisha,Marine Fish,Clupeidae,Brackish,Brackish/Marine (Anadromous). Spends most of its life in the sea but migrates to large rivers (like the Ganga and Godavari) to spawn.,Least Concern,LC,"Heavy overfishing and the presence of dams and barrages which block access to upstream spawning grounds, severely impacting recruitment","Strict seasonal fishing bans, establishing fish passages on dams, and pollution control in major rivers.",31262.42857,0.154586963,0.197569276,0.769514144,0.396783426,0.572871395,0.549627081,0.153706227,3.53
Yellowstripe Goatfish,Upeneus vittatus,Marine Fish,Mullidae,Marine,"Found in coastal waters, sand flats, and coral reefs, foraging on the bottom.",Least Concern,LC,"Commercial fishing pressure, particularly from trawling",Monitoring fishing efforts.,24484.28571,0.124759312,0.208670469,0.726324506,0.589644969,0.628322708,0.565659678,0.11048833,3.97
Crimson Snapper,Lutjanus erythropterus,Marine Fish,Lutjanidae,Marine,Found on offshore reefs and rocky bottoms.,Least Concern,LC,Fishing pressure as it is a commercially important reef fish,Implementing size limits and protecting reef habitats.,28407.14286,0.154852642,0.19171257,0.673386518,0.430063795,0.515669878,0.548471665,0.078229579,3.49
Kawakawa,Euthynnus affinis,Little Tuna,Scombridae,Marine,"A fast-swimming, pelagic fish found in coastal and offshore waters, often in large schools.",Least Concern,LC,High fishing pressure,Monitoring stock levels to ensure sustainable harvest.,20723.14286,0.15249487,0.21322608,0.600276948,0.580012484,0.226986693,0.475472928,0.073822169,3.14
Giant Sea Perch,Lates calcarifer,Asian Sea Bass/Bhekti,Latidae,Brackish,"Brackish/Marine (Euryhaline). Highly adaptable, found in estuaries, coastal waters, rivers, and lagoons. Juveniles utilize mangrove areas as nurseries.",Least Concern,LC,Overfishing and habitat loss in critical mangrove and estuarine nursery areas due to coastal development and pollution,Protecting estuarine and mangrove habitats is vital. Sustainable management of both wild catch and aquaculture practices.,25248,0.103241421,0.205169934,0.722084228,0.384358174,0.503147871,0.50758231,0.116042978,3.33
Fine,Saurida microlepis,Marine Fish,Synodontidae,Marine,Found on sandy and muddy bottoms of the continental shelf in coastal and offshore waters. It is a predatory bottom-dwelling fish.,Least Concern,LC,"Trawl fishing pressure as it is often caught as bycatch, although it is also commercially utilized",Sustainable management of bottom trawling activities.,23451.57143,0.132475317,0.172822431,0.543468475,0.454334911,0.383014468,0.557584125,0.159190276,3.32
Malabar Snapper,Lutjanus malabaricus,Marine Fish,Lutjanidae,Marine,Found in coastal and offshore waters near rocky reefs and coral formations.,Near Threatened,NT,Heavy fishing pressure due to its high commercial value,Implementing Marine Protected Areas (MPAs) and enforcing strict size and catch limits.,20272.57143,0.151221166,0.166127513,0.586754223,0.53351335,0.372309064,0.536553601,0.124477107,4.4
Blue Swimming Crab,Portunus pelagicus,Crustacean,Portunidae,Marine,Found in coastal and estuarine waters over sand and mud bottoms. Highly valued commercial species.,Not Evaluated,N/A,"Intense, unregulated fishing pressure and destruction of coastal nursery habitats","Implementing seasonal closures and strict size regulations, especially to protect spawning females. Protecting seagrass and estuarine habitats.",29958.71429,0.162257789,0.171387933,0.532998542,0.551508499,0.570041787,0.49020141,0.058223303,5.19
Green Mussel,Perna viridis,Mollusc,Mytilidae,Marine (Coastal),"Found attached to rocky substrates, jetties, and boat hulls in the intertidal and subtidal zones of coastal waters.",Not Evaluated,N/A,Pollution,Monitoring coastal water quality and promoting sustainable harvesting practices.,15713.42857,0.136836004,0.190372598,0.524088787,0.5199247,0.458626082,0.572328623,0.126718114,5.08
Climbing Perch,Anabas testudineus,Freshwater Fish,Anabantidae,Freshwater,"Found in stagnant or sluggish water like swamps, rice paddies, and ditches. It's famous for its ability to breathe atmospheric air and ""walk"" short distances on land.",Least Concern,LC,Habitat loss due to the draining of wetlands and swamps,Protecting wetland and swamp habitats.,27196.71429,0.110446682,0.244837573,0.671613105,0.350620725,0.513950757,0.36763637,0.163387644,3.05
Malabar Grouper,Epinephelus malabaricus,Marine Fish,Serranidae,Marine,"Found in coastal reefs, rocky areas, and estuaries. Juveniles often utilize mangroves as nurseries.",Near Threatened,NT,Heavy fishing pressure,Establishing Marine Protected Areas (MPAs) to safeguard breeding grounds and implementing size limits.,23627.28571,0.109686987,0.163872797,0.581666562,0.601034512,0.330365591,0.354244114,0.131669598,4.14
Spotted Dragonet,Dactylopus dactylopus,Marine Fish,Callionymidae,Marine,Found on sandy and muddy bottoms in shallow coastal waters.,Least Concern,LC,Habitat damage from bottom trawling,Monitoring fishing methods in its habitat.,26795.14286,0.142249719,0.176526834,0.58666956,0.529701374,0.37433034,0.529686659,0.160048808,3.39
Longtail Tuna,Thunnus tonggol,Marine Fish,Scombridae,Marine,Found in coastal and offshore waters over continental shelves. It's a highly valued commercial tuna species.,Least Concern,LC,Heavy fishing pressure across its range,Regional cooperation on monitoring and implementing sustainable fishing quotas.,25847,0.152043741,0.160185073,0.570962133,0.573048434,0.648463483,0.445537544,0.129062557,3.78
Striped Catfish,Plotosus lineatus,Marine Fish,Plotosidae,Marine,"Marine/Brackish. Found in coastal areas, estuaries, and coral reefs. It is a schooling fish and possesses venomous spines.",Least Concern,LC,No major threats,None specifically needed.,20323.85714,0.125349632,0.152449508,0.504336584,0.455630867,0.537300795,0.538588766,0.12360695,3.55
Snubnose Emperor,Lethrinus miniatus,Marine Fish,Lethrinidae,Marine,"Found around coral reefs, rocky areas, and sandy bottoms in coastal and outer reef slopes.",Least Concern,LC,Fishing pressure as it is a commercially important reef fish,Protecting reef habitats and regulating fishing.,18619.57143,0.137206238,0.126969721,0.54844071,0.400847459,0.479372485,0.565046076,0.156845022,3.41
Striped Bonito,Sarda orientalis,Marine Fish,Scombridae,Marine,"A highly migratory, pelagic fish found in coastal and open ocean waters.",Least Concern,LC,"Commercial fishing pressure, particularly from purse seines and gillnets",Monitoring fishing effort and quotas.,25935.14286,0.147825062,0.186987626,0.58654604,0.434398783,0.530763777,0.724574634,0.154590533,3.82
Grey Mullet,Mugil cephalus,Striped Mullet,Mugilidae,Brackish,"Brackish/Marine. Found in coastal lagoons, estuaries, and offshore waters. It is an important food fish.",Least Concern,LC,Habitat degradation in estuaries,Protecting and restoring estuarine habitats and managing water quality.,35589.57143,0.134391188,0.19668525,0.554343612,0.532251938,0.542622592,0.599870211,0.115809597,3.79
Largescale Mullet,Liza macrolepis,Marine Fish,Mugilidae,Brackish,"Brackish/Marine. Found in estuaries, lagoons, and coastal waters.",Least Concern,LC,Pollution and habitat degradation in its coastal and estuarine habitats,Reducing coastal pollution and protecting nursery grounds.,35206.42857,0.127570251,0.193076318,0.534722331,0.485259464,0.412996615,0.407860342,0.109719636,3.18
Indian White Prawn,Penaeus indicus,Crustacean,Penaeidae,Marine,"Juveniles are found in estuaries and backwaters (nursery grounds), while adults live in coastal marine waters. Highly important commercial species.",Not Evaluated,N/A,Intensive fishing pressure and habitat loss in estuarine nursery areas due to pollution and coastal development,"Sustainable fishery management, including seasonal closures and protecting estuarine ecosystems.",29042.14286,0.11978206,0.204629239,0.452350748,0.510948053,0.531783447,0.480859092,0.115294712,5.04
Tiger Prawn,Penaeus monodon,Giant Tiger Prawn,Penaeidae,Marine,Juveniles use estuaries and mangroves as nursery grounds; adults live in coastal and offshore marine waters.,Not Evaluated,N/A,Intense fishing pressure from trawling and gillnets,"Sustainable fishing regulations, protection of mangrove habitats, and best practices for aquaculture to prevent disease transfer.",26373.28571,0.158604515,0.211086567,0.38162608,0.44114836,0.423773778,0.469808234,0.13064477,4.72
Flower Prawn,Penaeus semisulcatus,Crustacean,Penaeidae,Marine,Found in coastal waters over sandy and muddy bottoms. Juveniles often found in brackish water.,Not Evaluated,N/A,Heavy fishing pressure and habitat degradation of coastal nursery areas,Monitoring stock levels and ensuring fishing practices are sustainable.,25921.14286,0.117517915,0.164491547,0.441204814,0.437188255,0.371380097,0.418505606,0.136329472,4.55
Brown Shrimp,Metapenaeus monoceros,Crustacean,Penaeidae,Marine,Found over muddy and sandy bottoms in coastal waters and estuaries. It is a highly important commercial shrimp.,Not Evaluated,N/A,Intensive trawling and coastal pollution affecting its breeding and nursery grounds,Regulating bottom trawling to reduce fishing mortality and bycatch.,20682.42857,0.126475197,0.132524842,0.638739917,0.502284747,0.551193426,0.592794104,0.10468059,5.24
Green Tiger Prawn,Penaeus monodon,Crustacean,Penaeidae,Marine,This is a repetition of the Tiger Prawn (Penaeus monodon).,Not Evaluated,N/A,Intense fishing and coastal,Sustainable fishing and protection of mangrove habitats.,20704.14286,0.126672845,0.202191235,0.682434316,0.606743768,0.464041879,0.416301171,0.086520129,4.98
Octopus,Octopus sp. (General),General,Octopodidae,Marine,"Found in various habitats, including coral reefs, rocky areas, and sandy/muddy bottoms, from intertidal zones to deep water.",Varies widely by species,N/A,"Fishing pressure, often as bycatch but increasingly targeted",Implementing responsible fishing practices; protecting coastal and benthic habitats.,22377.42857,0.083422376,0.187664348,0.534051693,0.483925953,0.480627512,0.462367744,0.090852934,4.88
Squid,Loligo duvaucelii (Indian Squid),Indian Squid,Loliginidae,Marine,"Found in coastal and offshore waters over the continental shelf. They are fast-growing, short-lived pelagic predators.",Least Concern,LC,Intense fishing pressure,Regional monitoring of fishing effort and sustainable management plans.,30834.57143,0.131367307,0.183747672,0.704552041,0.469246748,0.55550743,0.465762666,0.091718127,3.48
Giant Scad,Caranx ignobilis,Marine Fish,Carangidae,Marine,"This is a repetition of the Giant Trevally (Caranx ignobilis) (see No. 175). Found in reefs, open coastal waters, and estuaries.",Least Concern,LC,Overfishing,Regulating fishing size and catch limits.,25910.14286,0.141370648,0.160955241,0.540569098,0.483104147,0.396240682,0.437500102,0.125219379,3.19
Yellowfin Bream,Acanthopagrus berda,Black Sea Bream,Sparidae,Brackish,"Brackish/Marine. Found in coastal waters, estuaries, and lower river reaches.",Least Concern,LC,Habitat degradation in estuaries due to pollution and development,Protection of estuarine habitats.,25889.57143,0.116405664,0.209352358,0.66953982,0.53008405,0.472602187,0.392125356,0.08421786,3.32
Tigertooth Croaker,Otolithes ruber,Marine Fish,Sciaenidae,Marine,"Found in coastal waters, estuaries, and offshore over sand or mud bottoms. Highly valued for its swim bladder.",Least Concern,LC,"Intense fishing pressure, particularly due to the high value of its swim bladder",Managing fishing effort and implementing appropriate size limits.,26631.42857,0.131522772,0.225868642,0.452470113,0.377279527,0.462130796,0.488352521,0.150020354,3.21
White Grunt,Pomadasys hasta,Silver Grunt,Haemulidae,Marine,"Found in coastal waters, estuaries, and turbid areas, often over sand or mud bottoms.",Least Concern,LC,Overfishing and coastal habitat degradation,Sustainable fishing practices.,26079.42857,0.110862223,0.170473844,0.664862744,0.471443073,0.4246417,0.61296707,0.166602745,3.52
Blue,Neotrygon kuhlii,Marine Fish,Dasyatidae,Marine,Found on sandy bottoms near coral reefs in shallow coastal waters.,Near Threatened,NT,Bycatch in bottom trawling and gillnet fisheries,Reducing fishing efforts in sensitive coastal areas and protecting reef habitats.,30828.14286,0.067362298,0.213293034,0.622672956,0.483634077,0.355159143,0.518161386,0.132302436,4.26
Reticulate Whipray,Himantura uarnak,Marine Fish,Dasyatidae,Marine,"Found in coastal waters, estuaries, and coral reefs.",Vulnerable,VU,Heavy fishing pressure and habitat loss of coastal and estuarine environments,Regulating fishing and protecting coastal and estuarine habitats.,22929.28571,0.177987266,0.19754328,0.634325353,0.522896587,0.518430641,0.574170908,0.160314434,5.69
Indian Glassy Perchlet,Ambassis nama,Freshwater Fish,Ambassidae,Freshwater,"Found in stagnant or slow-moving water bodies like ponds, ditches, and tanks. It can tolerate slightly brackish water.",Least Concern,LC,Habitat loss due to the draining of small water bodies and pollution,None specifically needed; highly adaptable.,25830.71429,0.124837777,0.19161374,0.664504886,0.638902601,0.369404431,0.52632264,0.132936889,3.56
Malabar Sole,Cynoglossus macrostomus,Marine Fish,Cynoglossidae,Marine,A flatfish found on muddy and sandy bottoms in coastal waters.,Least Concern,LC,Trawl fishing pressure,Sustainable management of bottom trawling.,29342.57143,0.109023782,0.172877029,0.562510079,0.500962511,0.657330345,0.579653847,0.150664744,3.9
Needlefish,Tylosurus crocodilus,Crocodile Needlefish,Belonidae,Marine,"Found in coastal and open ocean waters, often near the surface.",Least Concern,LC,Fishing pressure as bycatch and some localized targeting,None specifically needed.,22296,0.138586388,0.202383422,0.52415877,0.527252212,0.46175145,0.41777107,0.092080519,3.34
Halfbeak,Hyporhamphus xanthopterus,Marine Fish,Hemiramphidae,Marine,"Found in coastal and estuarine waters, often near the surface.",Data Deficient,DD,Habitat degradation in coastal and estuarine areas,Further research is needed to determine its conservation status.,18732.28571,0.148366329,0.222277021,0.512510422,0.624095942,0.546092774,0.450149579,0.18566706,5.2
White Sardinella,Sardinella albella,Marine Fish,Clupeidae,Marine,Found in coastal waters in large schools.,Least Concern,LC,Heavy fishing pressure,Implementing size limits and monitoring stock health.,30326.42857,0.151803938,0.180685227,0.518203318,0.577711226,0.4897486,0.491598341,0.111265514,3.6
Gold,Sardinella gibbosa,Marine Fish,Clupeidae,Marine,Found in coastal waters in large schools.,Least Concern,LC,Heavy fishing pressure,Sustainable fishery management.,19254.42857,0.146505369,0.193748767,0.471703589,0.432354019,0.278631471,0.610778187,0.14184634,3.2
Indian Pellona,Ilisha melastoma,Marine Fish,Pristigasteridae,Marine,Found in coastal waters and estuaries.,Least Concern,LC,Fishing pressure and coastal pollution,Pollution control in coastal areas.,19439.71429,0.151432722,0.194386397,0.514668138,0.459251834,0.270516431,0.516280466,0.105471881,3.08
Moustache Anchovy,Thrissocles mystax,Marine Fish,Engraulidae,Marine,Found in coastal and estuarine waters. Forms large schools.,Least Concern,LC,Heavy fishing pressure,Monitoring stock levels.,26392,0.13701637,0.206510399,0.60458565,0.521750176,0.448163814,0.533328022,0.16338098,3.51
Bombay Anchovy,Stolephorus indicus,Marine Fish,Engraulidae,Marine,Found in coastal waters in large schools.,Least Concern,LC,High fishing pressure,Sustainable fishery management.,34645.85714,0.133494863,0.180903224,0.458466881,0.628497548,0.416365203,0.56819055,0.122193845,3.69
Indian Mackerel,Rastrelliger kanagurta,Marine Fish,Scombridae,Marine,Found in large schools in coastal waters.,Least Concern,LC,High fishing pressure and habitat pollution in near,Sustainable fishery management and reducing coastal pollution.,37280.28571,0.125773391,0.226072349,0.775103132,0.574461328,0.524715512,0.509488732,0.098882353,3.68
Tuna,Thunnus albacares,Yellowfin Tuna,Scombridae,Marine,"A large, highly migratory pelagic fish found in tropical and subtropical ocean waters.",Near Threatened,NT,Intense global fishing pressure,"International and regional fishery management plans, including quotas and size limits.",26873.42857,0.130048895,0.203874326,0.83161401,0.437439643,0.369680535,0.473650098,0.159461352,4.13
Skipjack Tuna,Katsuwonus pelamis,Marine Fish,Scombridae,Marine,"A small, fast-growing, highly migratory pelagic fish found in open tropical and subtropical ocean waters.",Least Concern,LC,High commercial fishing pressure,International cooperation on fishery management.,17699.28571,0.163712612,0.163638636,0.667756644,0.41073761,0.497914643,0.598379034,0.168256019,3.51
Frigate Tuna,Auxis thazard,Marine Fish,Scombridae,Marine,"A small, schooling, pelagic fish found in coastal and offshore waters.",Least Concern,LC,High fishing pressure,Monitoring fishing effort.,20731.42857,0.13068398,0.174804217,0.559703619,0.420428466,0.334968948,0.388959141,0.146879114,2.91
Indo,Scomberomorus guttatus,Marine Fish,Scombridae,Marine,Found in coastal waters over the continental shelf.,Least Concern,LC,Heavy fishing pressure,Implementing size limits and managing fishing quotas.,26090.57143,0.123599776,0.212129427,0.747986017,0.518731535,0.392730013,0.502644476,0.125794087,3.36
Spanish Mackerel,Scomberomorus commerson,Narrow-barred Spanish Mackerel,Scombridae,Marine,"A large, highly migratory, pelagic fish found in coastal and offshore waters.",Least Concern,LC,High commercial fishing pressure,Regional cooperation on implementing fishing quotas and size limits.,30397.14286,0.129585786,0.214795765,0.611028458,0.387342911,0.352145158,0.620250633,0.12183754,3.27
Cobia,Rachycentron canadum,Marine Fish,Rachycentridae,Marine,"Found in coastal waters, estuaries, and around reefs.",Least Concern,LC,Overfishing and increasing popularity in aquaculture,Monitoring wild stocks and regulating fishing.,20730,0.11886079,0.125731951,0.677472958,0.630920089,0.428979076,0.564361812,0.182822809,3.71
Snubnose Pompano,Trachinotus blochii,Marine Fish,Carangidae,Marine,"Found in shallow coastal waters, sandy beaches, and reefs. Juveniles frequent the surf zone.",Least Concern,LC,Habitat loss in critical juvenile areas,Protection of coastal and beach habitats.,26993.28571,0.142135,0.251913844,0.660797119,0.647240342,0.499222756,0.549216617,0.078218785,3.83
Giant Trevally,Caranx ignobilis,Marine Fish,Carangidae,Marine,"Found in reefs, open coastal waters, and estuaries. A large, predatory fish.",Least Concern,LC,Overfishing,Regulating fishing size and catch limits.,24460.85714,0.178660398,0.196467339,0.518726372,0.552318009,0.37129055,0.499548065,0.159151231,3.37
Yellowtail Scad,Atule mate,Marine Fish,Carangidae,Marine,"A schooling, pelagic fish found in coastal waters and around islands.",Least Concern,LC,Heavy fishing pressure,Monitoring catch levels to prevent overexploitation.,19070.57143,0.131764861,0.268164964,0.586730482,0.394329511,0.437659784,0.662969864,0.09090146,3.49
Talang Queenfish,Scomberoides commersonnianus,Marine Fish,Carangidae,Marine,"Found in coastal waters, lagoons, and near reefs. It is a fast-swimming predatory fish.",Least Concern,LC,Fishing pressure from various gear types,None specifically needed; monitoring fishing effort is sufficient.,20889.71429,0.161429992,0.148840418,0.528861455,0.482599195,0.39589512,0.631981453,0.127090281,3.52
Indian Snapper,Lutjanus johnii,Marine Fish,Lutjanidae,Marine,"Found over rocky bottoms, coral reefs, and in estuaries.",Least Concern,LC,Overfishing and habitat degradation of coastal areas and estuaries,Monitoring fishing pressure and protecting key nursery habitats.,18425,0.165583782,0.228176262,0.643192481,0.475196761,0.409215967,0.548565784,0.112668879,3.39
Humpback Red Snapper,Lutjanus gibbus,Marine Fish,Lutjanidae,Marine,Associated with offshore coral reefs and rocky areas.,Least Concern,LC,"Fishing pressure, especially on spawning aggregations",Protecting core reef habitats and managing fishing on spawning sites.,19296.14286,0.148796684,0.197372463,0.537538536,0.469967948,0.395376571,0.645514669,0.161102949,3.52
Russell's Snapper,Lutjanus russellii,Marine Fish,Lutjanidae,Marine,"Found in coastal and estuarine areas, often over mud or rubble.",Least Concern,LC,Overfishing and coastal habitat loss,Monitoring fishing effort and protecting estuarine areas.,29513.42857,0.173239823,0.113636969,0.623921136,0.543412163,0.512073744,0.427537986,0.162485558,3.47
Blackspot Snapper,Lutjanus fulviflammus,Marine Fish,Lutjanidae,Marine,"Juveniles are found in estuaries and mangroves, while adults inhabit coastal reefs and rocky areas.",Least Concern,LC,Overfishing and destruction of critical nursery habitats,"Protecting mangrove and estuarine ecosystems, and regulating fishing to protect breeding stocks.",33037.14286,0.092141651,0.257962341,0.714484869,0.436724577,0.408245157,0.52922591,0.128858864,3.29
Blue,Cephalopholis argus,Marine Fish,Serranidae,Marine,Highly associated with coral reefs and rocky bottoms.,Least Concern,LC,"Fishing pressure, especially spearfishing and hook",Establishing Marine Protected Areas (MPAs).,16977.85714,0.161285955,0.1396755,0.676453546,0.562444303,0.417387897,0.443732644,0.163394981,3.37
Coral Trout,Plectropomus leopardus,Marine Fish,Serranidae,Marine,Highly prized fish found exclusively in association with coral reefs.,Least Concern,LC,Heavy fishing pressure and severe coral reef loss due to climate change and pollution,Strict regulation of fishing and robust protection of coral reef health.,18783,0.155408025,0.133490097,0.576085342,0.280067266,0.292826635,0.450032986,0.152713362,2.7
Jewfish,Pseudosciaena diacanthus (Synonym for Protonibea diacanthus),Blackmouth Croaker,Sciaenidae,Marine,"A large, predatory fish found in coastal and offshore waters, often near estuaries. Prized for its swim bladder.",Near Threatened,NT,Extreme fishing pressure driven by the high value of its swim bladder,"Urgent regional management plans, including size and catch limits.",24704.42857,0.124529557,0.178635458,0.449760937,0.2799229,0.712354874,0.512417256,0.16003033,4.51
