Species_Name,Scientific_Name,Class_Type,Group_Family,Ecosystem,Habitat_Details,Conservation_Status,IUCN_Status_Code,Dominant_Threat_Factor,Conservation_Suggestions_Detailed,N_Current_Pop_Size,r_Intrinsic_Growth_Rate,Es_Environmental_Stochasticity,Habitat_Quality_Index,Threat_Score_Pollution,Threat_Score_Overfishing,Threat_Score_ClimateChange,Overharvest_Rate,Conservation_Priority_Score
Silver Mojarra,Gerres oyena,Marine Fish,Gerreidae,Marine,"Found in shallow coastal waters, sandy bottoms, and tidal creeks.",Least Concern,LC,"No major threats, as it is a common and widely distributed species",None specifically needed.,24962.57143,0.13770628,0.184314403,0.682965645,0.412238163,0.445958272,0.437390722,0.144103147,3.16
White,Siganus canaliculatus,Marine Fish,Siganidae,Marine,"Found in shallow, coastal waters, seagrass beds, and coral reefs. It is an herbivorous fish.",Least Concern,LC,Habitat destruction of seagrass beds and coral reefs,Protecting key feeding habitats like seagrass beds and reefs.,20655.71429,0.123374085,0.225823173,0.657745734,0.688313847,0.37824393,0.357483639,0.134601241,3.37
Indian White Prawn,Penaeus indicus,Crustacean,Penaeidae,Marine (Commercial),"Juveniles are found in estuaries and backwaters (nursery grounds), while adults live in coastal marine waters.",Not Evaluated,N/A,Intensive fishing pressure and habitat loss in estuarine nursery areas due to pollution and coastal development,"Sustainable fishery management, including seasonal closures and restrictions on gear that catches juveniles. Protecting estuarine ecosystems.",26543,0.136269542,0.192954301,0.528767794,0.482767645,0.535767451,0.622865761,0.110552938,5.24
Mud Crab,Scylla serrata,Crustacean,Portunidae,Brackish,"Brackish/Marine. Found in mangrove forests, estuaries, and muddy coastal areas. Highly valued commercial species.",Not Evaluated,N/A,"Heavy, unregulated fishing pressure and the destruction of mangrove habitats which are essential for the crab","Regulating fishing size limits, especially to protect female crabs. Urgent protection and restoration of mangrove ecosystems.",23143.42857,0.131044579,0.147412279,0.58541299,0.575214543,0.416454831,0.601170011,0.064757307,5.15
Wynaad Barb,Puntius wynaadensis,Freshwater Fish,Cyprinidae,Freshwater,"Endemic to the Wayanad region (Western Ghats), found in clear, upland streams and rivers.",Vulnerable,VU,Habitat loss and fragmentation due to deforestation and the construction of small dams,Protecting the specific hill stream habitats and maintaining the riparian vegetation along stream banks to prevent siltation.,22107,0.132009306,0.237089255,0.566874165,0.467137513,0.564367625,0.69335914,0.116814273,5.87
Bowany Barb,Puntius bovanicus,Freshwater Fish,Cyprinidae,Freshwater,Found in rivers and streams in the Bhavani River system (a major tributary of the Cauvery River) and surrounding areas of the Western Ghats.,Vulnerable,VU,Habitat degradation caused by dams and weirs which affect natural water flow and block migration routes,Ensuring environmental flow requirements in regulated rivers and monitoring fishing pressure.,23589.57143,0.08216088,0.197436052,0.568494878,0.596250389,0.552781359,0.460537622,0.133578048,5.68
Day's Baril,Barilius evezardi,Freshwater Fish,Cyprinidae,Freshwater,"Found in hill streams and rivers in the Satpura, Vindhya, and Western Ghats ranges, typically favoring clear, fast-flowing water.",Least Concern,LC,"Habitat degradation due to siltation and pollution, especially from mining activities in some areas",Protecting the water quality of its stream habitats.,23521.85714,0.122759603,0.203630766,0.661011686,0.39421691,0.523891277,0.511323339,0.137603811,3.38
Ghats Baril,Barilius gatensis,Freshwater Fish,Cyprinidae,Freshwater,"Endemic to the Western Ghats, inhabiting clear, torrential hill streams and upper reaches of rivers.",Least Concern,LC,Localized threats from habitat loss due to the construction of check dams and water diversion,Maintaining the natural flow and quality of its endemic hill streams.,17989.14286,0.104452239,0.210773496,0.665753973,0.71494224,0.431293494,0.536091741,0.088823048,3.8
Vagra Baril,Barilius vagra,Freshwater Fish,Cyprinidae,Freshwater,"Found in clear, fast-flowing rivers and streams throughout the northern Indian subcontinent and parts of peninsular India.",Least Concern,LC,No major threats,None specifically needed.,24267,0.130469665,0.190066023,0.525937173,0.598272313,0.459182941,0.440567755,0.126779486,3.5
Cauvery Rasbora,Rasbora caverii,Freshwater Fish,Cyprinidae,Freshwater,"Endemic to the Cauvery River drainage system. Found in clear, moderately flowing streams and rivers.",Vulnerable,VU,"Habitat degradation due to pollution, siltation, and fragmentation caused by damming projects",Protecting key stretches of the Cauvery tributaries and controlling pollution input.,30092.14286,0.121575259,0.126734619,0.553443942,0.561107507,0.36153971,0.398020355,0.133272776,5.2
Pabo Catfish,Ompok pabo,Freshwater Fish,Siluridae,Freshwater,"Found in rivers and lakes, preferring deep pools with muddy bottoms. It is a highly valued food fish.",Vulnerable,VU,Overfishing is a major threat due to its high market price,Implementing fishing regulations and protecting its deep-water river and wetland habitats.,19338.28571,0.117981172,0.184454688,0.424236481,0.473397533,0.419739421,0.529048078,0.127704014,5.37
Gogra Rita,Rita gogra,Freshwater Fish,Bagridae,Freshwater,Found in large rivers and deep pools.,Least Concern,LC,Overfishing and habitat degradation in major river systems,Promoting sustainable fishing practices.,19318.42857,0.099868447,0.237799914,0.335505442,0.590324606,0.447147007,0.309542019,0.116066841,3.25
King Mackerel,Scomberomorus commerson,Indo-Pacific King Mackerel,Scombridae,Marine,"A large, fast-swimming, pelagic fish found in coastal and offshore waters. It is highly migratory and a major commercial target.",Least Concern,LC,High commercial fishing pressure across its range,"Regional and international cooperation on implementing fishing quotas, size limits, and monitoring stock levels.",32771.28571,0.116078963,0.176681701,0.573246337,0.577579277,0.484225801,0.507226102,0.146299531,3.62
Ribbonfish,Trichiurus lepturus,Largehead Hairtail,Trichiuridae,Marine,"Found over continental shelves, often in large schools near the bottom or in mid-water.",Least Concern,LC,"Heavy fishing pressure due to high commercial value, often caught by bottom trawling",Monitoring fishing intensity and managing trawl fishing to minimize bycatch and habitat damage.,28816.42857,0.176111964,0.168667085,0.576843914,0.573432832,0.236767892,0.407703873,0.124449522,3.03
Bombay Duck,Harpadon nehereus,Bummalow,Synodontidae,Marine,"Found in coastal waters, estuaries, and offshore up to 100 meters. It is a major commercial species, commonly processed and dried.",Least Concern,LC,"Intense fishing pressure, although its rapid growth and abundance make it resilient",Monitoring stock levels to prevent overexploitation and reducing coastal pollution.,11319.14286,0.162768886,0.195570584,0.680723388,0.500126589,0.428709642,0.502310588,0.163887435,3.39
Malabar Grouper,Epinephelus malabaricus,Marine Fish,Serranidae,Marine,"Found in coastal areas on coral reefs, rocky substrates, and estuaries. Juveniles often utilize mangrove areas as nurseries.",Near Threatened,NT,Heavy fishing pressure,Establishing Marine Protected Areas (MPAs) to safeguard breeding grounds and implementing size limits to protect spawning stock.,20931.14286,0.135574549,0.222598664,0.629433494,0.445965399,0.557815302,0.532714985,0.110423833,4.56
Moontail Bullseye,Priacanthus hamrur,Marine Fish,Priacanthidae,Marine,"Found in coastal and offshore waters, usually near coral reefs or rocky bottoms. It is a nocturnal species.",Least Concern,LC,Fishing pressure from trawling and hook,Monitoring fishing intensity and managing catches.,21436.14286,0.104850971,0.221816724,0.558218959,0.591395592,0.386825916,0.386080112,0.142517964,3.27
Striped Mullet,Mugil cephalus,Marine Fish,Mugilidae,Brackish,"Brackish/Marine. Highly adaptable, found in coastal lagoons, estuaries, and offshore waters. It migrates to the sea to spawn.",Least Concern,LC,Habitat degradation in estuaries,Protecting and restoring estuarine habitats and managing water quality.,29618,0.120229755,0.115932824,0.54693091,0.544914381,0.523807225,0.48424773,0.124255931,3.59
Largescale Mullet,Liza macrolepis,Marine Fish,Mugilidae,Brackish,"Brackish/Marine. Found in estuaries, lagoons, and coastal waters. It is very tolerant of varying salinity levels.",Least Concern,LC,Pollution and habitat degradation in its coastal and estuarine habitats,Reducing coastal pollution and protecting nursery grounds.,20761,0.130108386,0.19735657,0.569308567,0.513137917,0.504799382,0.580818303,0.153743099,3.66
Moustache Anchovy,Thrissocles mystax,Marine Fish,Engraulidae,Marine,Found in coastal and estuarine waters. It forms large schools.,Least Concern,LC,Heavy fishing pressure as it,Monitoring stock health and ensuring sustainable fishing levels.,24885.71429,0.163747758,0.22196108,0.528136975,0.371436808,0.449485148,0.55658063,0.135259752,3.3
Blackfin Barracuda,Sphyraena putnamae,Marine Fish,Sphyraenidae,Marine,"Found in coastal, turbid waters, often over muddy bottoms. It is a predatory, schooling fish.",Least Concern,LC,Fishing pressure from trawling and line fishing,None specifically needed.,26091,0.121440953,0.215167634,0.661329172,0.335117714,0.408124588,0.464957714,0.134499819,3.01
Indian Garfish,Xenentodon cancila,Freshwater Fish,Belonidae,Freshwater,"Found in stagnant or slow-moving water bodies like ponds, canals, and ditches, usually among vegetation.",Least Concern,LC,Habitat loss due to the draining of wetlands and pollution,Protecting and maintaining wetland habitats.,23613.28571,0.120319627,0.214077713,0.587257917,0.450634338,0.534863249,0.450906171,0.14120469,3.39
Greater Lizardfish,Saurida tumbil,Marine Fish,Synodontidae,Marine,Found on sandy and muddy bottoms of the continental shelf in coastal and deeper waters.,Least Concern,LC,"Trawl fishing pressure as it is often caught as bycatch, although it is also commercially utilized",Sustainable management of bottom trawling.,23640.85714,0.127811876,0.249389694,0.548846482,0.52509542,0.559510868,0.552054468,0.117996921,3.73
Indian Scad,Decapterus russelli,Marine Fish,Carangidae,Marine,"A schooling, pelagic fish found in coastal waters and around islands.",Least Concern,LC,Heavy fishing pressure due to its commercial importance,Monitoring stock levels and enforcing sustainable fishing practices.,24560.85714,0.170881318,0.167263259,0.638866653,0.575330279,0.366356226,0.492028374,0.133807551,3.39
Talang Queenfish,Scomberoides commersonnianus,Marine Fish,Carangidae,Marine,"Found in coastal waters, lagoons, and near reefs. It is a fast-swimming predatory fish.",Least Concern,LC,Fishing pressure from various gear types,None specifically needed.,26518.85714,0.135241529,0.184579224,0.579962588,0.568665113,0.547077577,0.600721914,0.115259565,3.86
Snubnose Pompano,Trachinotus blochii,Marine Fish,Carangidae,Marine,"Found in shallow coastal waters, sandy beaches, and reefs. Juveniles occur in very shallow, surf zones.",Least Concern,LC,Habitat loss in critical juvenile areas,Protection of coastal and beach habitats.,16207.85714,0.136809028,0.156230568,0.571989865,0.524040181,0.633467426,0.454901197,0.150881685,3.69
Wahoo,Acanthocybium solandri,Marine Fish,Scombridae,Marine,"A large, highly migratory, pelagic fish found in open ocean waters. It is a solitary hunter.",Least Concern,LC,Recreational and commercial fishing pressure,International cooperation on monitoring and managing highly migratory species.,24874.14286,0.092437728,0.210334918,0.528881951,0.506555318,0.523032702,0.415538224,0.165066274,3.41
Bigeye Tuna,Thunnus obesus,Marine Fish,Scombridae,Marine,"A deep-dwelling, highly migratory, pelagic fish found in tropical and subtropical ocean waters.",Vulnerable,VU,Intense global fishing pressure,Regional Fishery Management Organizations (RFMOs) must implement and enforce strict catch limits and measures to protect juvenile stock.,24259.14286,0.099469965,0.15798942,0.579890727,0.270836392,0.459574926,0.421082727,0.150727521,4.92
Frigate Tuna,Auxis thazard,Marine Fish,Scombridae,Marine,"A small, schooling, pelagic fish found in coastal and offshore waters.",Least Concern,LC,"High fishing pressure, often caught in large schools",Monitoring fishing effort and stock levels.,23773.42857,0.117897967,0.183631732,0.564404133,0.622928916,0.414696288,0.546532153,0.12201311,3.64
Dorab Wolf,Chirocentrus dorab,Marine Fish,Chirocentridae,Marine,"Found in coastal waters and estuaries. A predatory fish with large, sharp teeth.",Least Concern,LC,Overfishing and coastal pollution,Sustainable fishing practices and pollution control in coastal zones.,25184.57143,0.104405818,0.236219811,0.688405037,0.666988417,0.491215018,0.565564514,0.168802031,3.87
Toothed Ponyfish,Gazza minuta,Marine Fish,Leiognathidae,Marine,"Found in shallow coastal waters, estuaries, and mudflats.",Least Concern,LC,Habitat degradation in coastal areas,None specifically needed.,26568.28571,0.123152695,0.175949118,0.678175219,0.492852737,0.418912546,0.457926436,0.177098194,3.28
Whipfin Mojarra,Gerres filamentosus,Marine Fish,Gerreidae,Marine,"Found in shallow, coastal waters, estuaries, and brackish lagoons.",Least Concern,LC,Habitat degradation of coastal nursery areas,Protecting estuarine habitats.,32062.57143,0.146341602,0.223061196,0.580448891,0.4380377,0.389473099,0.531590187,0.144126475,3.27
Blue,Valamugil seheli,Marine Fish,Mugilidae,Marine,"Found in coastal and estuarine waters, often entering fresh water.",Least Concern,LC,Overfishing and coastal habitat degradation,Monitoring fishing pressure.,20796,0.168820499,0.247136514,0.695755474,0.439866488,0.423876206,0.53836406,0.101482445,3.34
Paradise Threadfin,Polynemus paradiseus,Marine Fish,Polynemidae,Marine,"Found in shallow, coastal waters and estuaries, especially over mud and sand bottoms. Known for its long pectoral fin filaments.",Vulnerable,VU,Intense fishing pressure and habitat loss in its estuarine nursery areas,Protecting estuarine habitats and implementing fishing regulations.,32959.14286,0.153329345,0.224779816,0.548623018,0.424448099,0.596194831,0.437200749,0.136014955,5.43
Indian Grouper,Epinephelus coioides,Marine Fish,Serranidae,Marine,"Found in coastal and offshore reefs, rocky areas, and estuaries.",Near Threatened,NT,Heavy fishing pressure and destruction of coral reef and mangrove habitats,Establishing Marine Protected Areas (MPAs) and implementing size limits.,27899.57143,0.131757772,0.205297776,0.548348464,0.452930844,0.545591371,0.619867775,0.149890709,4.7
Pink Snapper,Pristipomoides filamentosus,Marine Fish,Lutjanidae,Marine,A deep-water snapper found over rocky bottoms and reefs on the continental shelf edge.,Least Concern,LC,Commercial deep,Monitoring deep-sea fishing effort to ensure sustainability.,34286.14286,0.163458433,0.213517489,0.658576177,0.555902413,0.434846553,0.518628068,0.140689159,3.52
Spot,Carcharhinus sorrah,Marine Fish,Carcharhinidae,Marine,Found in coastal waters on the continental and insular shelves.,Vulnerable,VU,Intense fishing pressure due to its valuable fins and meat,Implementing strict fishing quotas and protected areas to safeguard nursery grounds.,26693.14286,0.161929547,0.244341502,0.49338567,0.372154835,0.547466742,0.45537939,0.095255498,5.29
Spadenose Shark,Scoliodon laticaudus,Marine Fish,Carcharhinidae,Marine,"A small, schooling shark found in shallow, muddy coastal waters and estuaries.",Near Threatened,NT,High fishing pressure as it,Monitoring fishing pressure and protecting coastal nursery areas.,18606.85714,0.09865311,0.217154023,0.830286979,0.522483531,0.554259182,0.48541247,0.106552832,4.6
Reticulate Whipray,Himantura uarnak,Marine Fish,Dasyatidae,Marine,"Found in coastal waters, estuaries, and coral reefs.",Vulnerable,VU,Heavy fishing pressure and habitat loss of coastal and estuarine environments,Regulating fishing and protecting coastal and estuarine habitats.,30281.14286,0.089031546,0.260101972,0.690019404,0.412387055,0.485599732,0.562360197,0.15394538,5.43
Marbled Electric Ray,Torpedo marmorata,Marine Fish,Torpedinidae,Marine,Found on sandy or muddy bottoms in coastal waters. Known for its ability to produce electric shocks.,Vulnerable,VU,Bycatch in bottom trawling and gillnet fisheries,Reducing fishing efforts in sensitive coastal areas.,33245.28571,0.109020368,0.226141005,0.746984212,0.524687023,0.275431566,0.454480398,0.107217204,5.09
Japanese Tilefish,Branchiostegus japonicus,Marine Fish,Malacanthidae,Marine,"A deep-water, burrowing fish found over sandy or muddy bottoms on the continental shelf.",Least Concern,LC,Targeted fishing pressure for its meat,Monitoring deep-sea fishing efforts.,33831.28571,0.112360193,0.180952794,0.573672326,0.485685838,0.502764452,0.438718498,0.099683641,3.38
Silver Grunt,Pomadasys hasta,Marine Fish,Haemulidae,Marine,"Found in coastal waters, estuaries, and turbid areas, often over sand or mud bottoms.",Least Concern,LC,Overfishing and coastal habitat degradation,Sustainable fishing practices.,19771.57143,0.079806896,0.192298573,0.567464443,0.505603455,0.352885597,0.551961262,0.09293452,3.35
Spotted Grunt,Pomadasys kaakan,Marine Fish,Haemulidae,Marine,"Found in coastal and estuarine waters, often over muddy or sandy bottoms.",Least Concern,LC,Overfishing and coastal pollution,Monitoring fishing efforts in coastal areas.,23433.71429,0.102861566,0.176842982,0.697169324,0.466451796,0.424382872,0.471023761,0.192451602,3.27
Splendid Ponyfish,Leiognathus splendens,Marine Fish,Leiognathidae,Marine,"Found in coastal waters, estuaries, and mudflats. It's a small, schooling fish commonly caught by trawlers.",Least Concern,LC,"Heavy fishing pressure due to its abundance, though its resilience keeps the population stable",Monitoring stock levels to prevent localized overexploitation.,25056.85714,0.153763602,0.187807875,0.646213912,0.357203209,0.577163557,0.484187455,0.154032676,3.36
Bindus Ponyfish,Leiognathus bindus,Marine Fish,Leiognathidae,Marine,"Inhabits coastal and brackish waters, often found over muddy bottoms.",Least Concern,LC,"Similar to other ponyfish, it faces heavy fishing pressure and coastal pollution",Sustainable fishing practices in coastal areas.,22007.14286,0.16870779,0.200296386,0.622363616,0.299208306,0.371124905,0.362890453,0.149103714,2.72
Indian Threadfin,Polydactylus indicus,Marine Fish,Polynemidae,Marine,"Found in coastal waters and estuaries, typically over muddy substrates. It is a large, highly valued food fish.",Vulnerable,VU,Severe overfishing due to its high commercial value,Implementing and strictly enforcing fishing quotas and minimum size limits. Protecting estuarine and near-shore habitats.,35357.28571,0.185009551,0.206335033,0.551318768,0.494140502,0.541420227,0.478523357,0.173023071,5.52
Peacock Damselfish,Pomacentrus pavo,Marine Fish,Pomacentridae,Marine,"Associated with coral reefs and rocky areas, particularly those with branching corals and dense rubble.",Least Concern,LC,Coral reef degradation due to climate change,Protecting coral reef ecosystems and regulating the aquarium trade.,16102.85714,0.128720782,0.166710672,0.506722683,0.541127084,0.390304875,0.508836295,0.134633412,3.4
Tigertooth Croaker,Otolithes ruber,Marine Fish,Sciaenidae,Marine,"Found in coastal waters, estuaries, and offshore areas over sand or mud bottoms. Highly valued for its swim bladder (fish maw).",Least Concern,LC,"Intense fishing pressure is the main threat, driven largely by the high value of its swim bladder",Implementing size limits and managing the fishing effort on this stock.,29852.28571,0.11122391,0.241498547,0.601899176,0.417585219,0.399695342,0.63201036,0.114501133,3.42
Jewfish,Pseudosciaena diacanthus (Synonym for Protonibea diacanthus),Blackmouth Croaker,Sciaenidae,Marine,"A large, predatory fish found in coastal and offshore waters, often near estuaries. Highly prized for its meat and swim bladder.",Near Threatened,NT,Extreme fishing pressure due to the very high commercial value of its swim bladder,"Urgent regional management plans, including size and catch limits, to prevent overfishing of the breeding stock.",20457.42857,0.108818822,0.20776096,0.500695821,0.607102922,0.538038488,0.531293675,0.112398678,4.79
Karut Croaker,Johnius carutta,Marine Fish,Sciaenidae,Marine,"Found in shallow coastal waters and estuaries, often over muddy substrates.",Least Concern,LC,Heavy fishing pressure due to its commercial value,Monitoring coastal fishing activities.,24657,0.156723132,0.192399695,0.648506375,0.335187882,0.328149875,0.513281454,0.1098275,2.96
Corsula Mullet,Rhinomugil corsula,Freshwater Fish,Mugilidae,Freshwater (Primary),"Unusually for mullets, this species is found almost entirely in freshwater, specifically in rivers and large canals. It often swims near the surface.",Least Concern,LC,Habitat degradation in riverine systems due to pollution and sand mining,Protecting river water quality and regulating sand mining.,30012.57143,0.124762171,0.208774472,0.515939086,0.571547596,0.345612376,0.663769422,0.189403011,3.63
Soldier Catfish,Osteogeneiosus militaris,Marine Fish,Ariidae,Marine,"Found in coastal waters, estuaries, and brackish lagoons. Known for its venomous dorsal and pectoral spines.",Least Concern,LC,Unknown,None specifically required.,31587.85714,0.162957767,0.165732446,0.584666471,0.610335616,0.450355057,0.431912814,0.135695306,3.49
Arabian Houndshark,Mustelus mosis,Marine Fish,Triakidae,Marine,"Found in coastal and shelf waters, usually over sandy or muddy bottoms.",Vulnerable,VU,"Intense fishing pressure from bottom trawling and gillnets, as it","Implementing and enforcing strict fishing quotas, especially on fishing gear that targets the seabed.",27825,0.125521748,0.19563153,0.678033343,0.416441029,0.709480211,0.399625169,0.118311095,5.54
Vigors' Carp,Osteobrama vigorsii,Freshwater Fish,Cyprinidae,Freshwater,Endemic to the Krishna and Godavari River systems. Found in reservoirs and deeper pools of rivers.,Least Concern,LC,Habitat fragmentation from dams and introduction of non,Protecting the genetic purity of wild populations and managing dam operations to allow for fish migration.,19994.85714,0.097445671,0.153681777,0.635822664,0.398238526,0.366701629,0.331068787,0.175019162,2.83
Mola Carplet,Amblypharyngodon mola,Freshwater Fish,Cyprinidae,Freshwater,"A small, schooling fish found in ponds, canals, ditches, and stagnant water bodies.",Least Concern,LC,Habitat loss due to the draining of small wetlands and pollution,Protecting small freshwater bodies.,33342.14286,0.12453647,0.215180553,0.523748847,0.568465082,0.517804424,0.552639278,0.152794805,3.73
Attentive Carplet,Amblypharyngodon melettinus,Freshwater Fish,Cyprinidae,Freshwater,"Found in ponds, tanks, and streams in the Western Ghats region.",Least Concern,LC,Habitat loss and competition from introduced fish species,None specifically required.,28962.85714,0.146412696,0.207288497,0.61906073,0.360221083,0.412772986,0.524904017,0.126753344,3.16
Slender Rasbora,Rasbora daniconius,Freshwater Fish,Cyprinidae,Freshwater,"A very common and widespread species found in almost all freshwater types, including rivers, streams, ponds, and rice paddies.",Least Concern,LC,None major,None specifically needed.,23812,0.152622926,0.240156671,0.615068934,0.57614628,0.484776297,0.490573258,0.124061459,3.59
Long,Sperata aor,Freshwater Fish,Bagridae,Freshwater,A large predatory catfish found in main channels of large rivers and deep reservoirs.,Near Threatened,NT,Overfishing due to high demand for its meat,Regulating fishing pressure and protecting large river habitats.,20346,0.132821714,0.201238214,0.678356229,0.414453709,0.381541035,0.536285524,0.15525667,4.22
Stinging Catfish,Heteropneustes fossilis,Freshwater Fish,Heteropneustidae,Freshwater,"Found in stagnant or muddy water bodies like swamps, ditches, and ponds. Known for its painful, venomous sting.",Least Concern,LC,None major,None specifically needed.,27369.85714,0.12254026,0.23526955,0.545714489,0.501633107,0.423089778,0.369407634,0.167420553,3.16
Magur,Clarias batrachus,Catfish,Clariidae,Freshwater,"Found in stagnant or sluggish water bodies like swamps, muddy ponds, and ditches. It's an air-breathing fish highly tolerant of low dissolved oxygen.",Vulnerable,VU,Habitat loss due to the draining of wetlands and swamps,Protecting wetland and swamp habitats. Controlling the spread of the invasive African Catfish.,24076.14286,0.127862043,0.220715523,0.565549064,0.457148487,0.271263702,0.591976774,0.127234641,5.2
African Catfish,Clarias gariepinus,Exotic,Clariidae,Freshwater (Invasive),"Highly adaptable, found in almost any type of freshwater body, including rivers, lakes, and reservoirs. It is a voracious predator and air-breather.",Not Applicable,N/A,"As an invasive species, it poses a severe threat to native fish fauna by predating on them and outcompeting native species like the Magur for resources",Strict regulation and enforcement to prevent its illegal culture and release into natural water bodies. Eradication efforts where feasible.,25902.85714,0.144994187,0.192800212,0.671566423,0.53498663,0.514657323,0.366796665,0.147394178,4.86
Mozambique Tilapia,Oreochromis mossambicus,Exotic,Cichlidae,Freshwater (Invasive),"Extremely hardy and tolerant of a wide range of salinities and temperatures; found in lakes, reservoirs, and brackish estuaries.",Not Applicable,N/A,"Highly competitive, leading to the displacement of native fish species",Preventing its spread into new water systems. Promoting sustainable aquaculture practices that do not use open systems.,29661.85714,0.169995181,0.208150174,0.681685548,0.512879758,0.343815104,0.450074457,0.078083968,4.68
